show_id,type,title,director,cast,country,date_added,release_year,rating,duration,listed_in,description,Year_added,Month_added,duration_mins,duration type
80201820,Movie,Coffee with D,Vishal Mishra,"Sunil Grover, Zakir Hussain, Anjana Sukhani, Dipannita Sharma, Pankaj Tripathi, Rajesh Sharma, Vinod Ramani, Guru Singh",India,2017-11-01,2017,TV-PG,120 min,"Comedies, Independent Movies, International Movies",Low TV ratings drive a well-known journalist to concoct a plan to interview a notorious underworld figure who is also a suspected terrorist.,2017,November,120,min
80203791,Movie,Kacche Dhaagey,Buta Singh,"Yograj Singh, Nitu Pandher, Deep Mandian, Shreya Chawla, Jagpal Singh Chahal, Jyoti Sharma, Janak Joshi, Karan Vinayak",India,2017-11-01,2016,TV-14,120 min,"Dramas, International Movies, Romantic Movies","While visiting India for her cousin's wedding, a Canadian girl develops strong feelings for a boy from a lower caste.",2017,November,120,min
80079229,Movie,Kis Kisko Pyaar Karoon,"Abbas Alibhai Burmawalla, Mastan Alibhai Burmawalla","Kapil Sharma, Arbaaz Khan, Varun Sharma, Sharat Saxena, Supriya Pathak, Manoj Joshi, Manjari Fadnis, Simran Kaur Mundi, Elli Avram, Jamie Lever",India,2017-11-01,2015,TV-PG,132 min,"Comedies, International Movies","A man's decision to marry three women, to keep them from committing suicide, complicates his relationship with his girlfriend.",2017,November,132,min
80216270,Movie,One Heart: The A.R. Rahman Concert Film,,A.R. Rahman,India,2017-11-01,2017,TV-G,87 min,"Documentaries, International Movies, Music & Musicals","In this concert film, Indian musical maestro A.R. Rahman performs 15 of his most popular songs and reveals himself through interviews and clips.",2017,November,87,min
80203786,Movie,Rivaaz,Ashok Nanda,"Deepti Naval, Vijay Raaz, Meghna Naidu, Saadhika Randhawa, Ritisha Vijayvargya, Manoj Biddvai, Sayaji Shinde, Reema Lagoo",India,2017-11-01,2011,TV-MA,107 min,"Dramas, Independent Movies, International Movies","In a village where girls are auctioned off rather than married, a man falls in love with a girl who is about to face the bidders.",2017,November,107,min
80201827,Movie,Trip to Bhangarh: Asia's Most Haunted Place,Jitender Pawar,"Manish Chaudhary, Suzanna Mukherjee, Piyush Raina, Rachit Behl, Rohit Chaudhury, Vikram Kochhar, Poonam Pandey",India,2017-11-01,2014,TV-MA,113 min,"International Movies, Thrillers","To amuse themselves, six college friends decide to pay a visit to a fortress believed by some to be the most haunted place in Asia.",2017,November,113,min
80203780,Movie,Waarrior Savitri,Param Gill,"Niharica Raizada, Rajat Barmecha, Lucy Pinder, Om Puri, Gulshan Grover, Tim Man, Ron Smoorenburg, KaramVeer Chaudhary",India,2017-11-01,2016,TV-14,120 min,"Action & Adventure, International Movies, Sci-Fi & Fantasy","In a modern adaptation of a mythological tale, a devoted wife is willing to do whatever it takes to rescue her husband from the clutches of death.",2017,November,120,min
80211371,Movie,Yaara O Dildaara,Ksshitij Chaudhary,"Harbhajan Mann, Tulip Joshi, Kabir Bedi, Gulzar Chahal, Jonita, Gurpreet Ghuggi, Gurpreet Grewal, Neena Cheema, Sunita Dhir",India,2017-11-01,2011,TV-14,132 min,"Dramas, International Movies, Music & Musicals",The patriarch of a wealthy family with one industrious son and one who's a playboy arranges for the marriage of one to the woman the other loves.,2017,November,132,min
70109249,Movie,C Kkompany,Sachin Yardi,"Mahesh Bhatt, Mithun Chakraborty, G.K. Desai, Celina Jaitly, Karan Johar, Ekta Kapoor, Tusshar Kapoor, Anupam Kher, Ashok Pandit, Lalit Parashar, Raima Sen, Rajpal Yadav",India,2019-05-31,2008,TV-14,127 min,"Action & Adventure, Comedies, International Movies","To blow off some steam, friends Akshay, Joshi and Lambodar, posing as a gang called C Kkompany, make a phony extortion demand to Joshi's apathetic son. The trio is shocked when their prank call makes them anonymous celebrities.",2019,May,127,min
80993095,Movie,Chopsticks,Sachin Yardi,"Abhay Deol, Mithila Palkar, Vijay Raaz",India,2019-05-31,2019,TV-MA,101 min,"Comedies, Dramas, Independent Movies",A gifted but insecure woman embarks on a transformative journey when she enlists an enigmatic con man to recover her stolen car from an eccentric thug.,2019,May,101,min
70045644,Movie,Koi Aap Sa,Partho Mitra,"Aftab Shivdasani, Natassha, Dipannita Sharma, Himanshu Mallik, Vaidya Advai, Pushy Anand, Shama Deshpande, Rajendra Gupta",India,2019-05-31,2006,TV-14,135 min,"Comedies, International Movies, Music & Musicals","Star athlete Rohan has his eye on a beautiful art student. But when his best friend Simran experiences a crisis, he drops everything to help her.",2019,May,135,min
70025612,Movie,Krishna Cottage,Santram Varma,"Sohail Khan, Isha Koppikar, Natasha, Rati Agnihotri",India,2019-05-31,2004,TV-MA,124 min,"Action & Adventure, Horror Movies, International Movies",True love is put to the test when another woman comes between a pair of star-crossed young lovers in this thriller.,2019,May,124,min
80237006,Movie,Mere Pyare Prime Minister,Rakeysh Omprakash Mehra,"Anjali Patil, Om Kanojiya, Niteesh Wadhwa, Makrand Deshpande, Syna Anand, Prasad, Adarsh, Rasika Agashe",India,2019-05-31,2019,TV-MA,103 min,"Dramas, International Movies","When his mother suffers a traumatic incident, a boy from the Mumbai slums treks to Delhi to deliver his written plea for justice to the Prime Minister.",2019,May,103,min
80083930,Movie,Ragini MMS,Pawan Kripalani,"Kainaz Motivala, Rajkummar Rao, Rajat Kaul, Janice, Shernaza, Mangala Ahire, Vinod Rawat",India,2019-05-31,2011,TV-MA,93 min,"Horror Movies, International Movies",A couple out to have a sensuous weekend at a house outside of Mumbai finds it rigged with surveillance cameras and occupied by an evil entity.,2019,May,93,min
80083752,Movie,Ragini MMS 2,Bhushan Patel,"Sunny Leone, Saahil Prem, Parvin Dabas, Sandhya Mridul, Divya Dutta, Soniya Mehra, Kainaz Motivala, Karan Mehra",India,2019-05-31,2014,TV-MA,113 min,"Horror Movies, International Movies",The horror continues when Ragini's video goes viral and a sleazy director decides to make a movie about the incident in the original house.,2019,May,113,min
70185023,Movie,Shor In the City,"Raj Nidimoru, Krishna D.K.","Sendhil Ramamurthy, Tusshar Kapoor, Nikhil Dwivedi, Preeti Desai, Sundeep Kishan, Radhika Apte, Pitobash, Girija Oak, Alok Chaturvedi, Sudhir Chowdhary",India,2019-05-31,2011,TV-MA,106 min,"Comedies, Dramas, Independent Movies","When three small-time Mumbai crooks steal a bag on a train, they find that it's filled with weapons and realize that their lives may be in danger.",2019,May,106,min
80176342,Movie,Rangoon,Vishal Bhardwaj,"Saif Ali Khan, Shahid Kapoor, Kangana Ranaut, Shriswara, Richard McCabe, Satoru Kawaguchi, Surendra Pal, Lin Laishram",India,2017-05-29,2017,TV-14,153 min,"Action & Adventure, Dramas, International Movies","During World War II, daredevil star Miss Julia entertains soldiers at the Indo-Burma border, where she's caught up in a web of love and deceit.",2017,May,153,min
80164778,Movie,Raees,Rahul Dholakia,"Shah Rukh Khan, Mahira Khan, Nawazuddin Siddiqui, Mohammed Zeeshan Ayyub, Sheeba Chaddha, Shubham Chintamani, Shubham Tukaram, Atul Kulkarni, Narendra Jha, Jaideep Ahlawat, Sunny Leone",India,2017-05-26,2017,NR,143 min,"Action & Adventure, Dramas, International Movies","After street smart kid Raees rises to become Gujarat's bootlegging king in the 1980s, he tries to balance his life of crime with helping his people.",2017,May,143,min
81132060,TV Show,Thackeray,,,India,2019-05-25,2019,TV-MA,1 Season,TV Shows,"From controversial cartoonist to powerful Mumbai politician, this biopic maps the meteoric rise of far-right Shiv Sena party founder, Bal Thackeray.",2019,May,1,Season
80084666,Movie,Colours of Passion,Ketan Mehta,"Randeep Hooda, Nandana Sen, Jim Boeven, Paresh Rawal, Tom Alter, Vikram Gokhale, Vipin Sharma, Gaurav Dwivedi",India,2018-05-25,2008,TV-14,114 min,"Dramas, International Movies","Seeking inspiration, a young 19th-century painter finds a woman who is his love, his muse and his willing subject, but his work becomes controversial.",2018,May,114,min
81057229,Movie,The Man Who Feels No Pain,Vasan Bala,"Abhimanyu Dassani, Radhika Madan, Gulshan Devaiah, Mahesh Manjrekar, Jimit Trivedi, Loveleen Mishra, Sartaaj Kakkar, Riva Arora",India,2019-05-22,2018,TV-MA,137 min,"Action & Adventure, Comedies, International Movies","Leveraging his ability to withstand pain, a young man trains to follow in the footsteps of his martial-arts hero in this high-action, meta comedy.",2019,May,137,min
81005364,Movie,Zero,Aanand Rai,"Shah Rukh Khan, Anushka Sharma, Katrina Kaif, Mohammed Zeeshan Ayyub, Tigmanshu Dhulia, Sheeba Chaddha, Brijendra Kala, Mallika Dua, Abhay Deol, Madhavan",India,2019-05-21,2018,TV-14,159 min,"Comedies, Dramas, International Movies","Through his relationships with two wildly different women, a vertically challenged bachelor with a larger-than-life persona must discover his purpose.",2019,May,159,min
81096151,Movie,Laatu,Manav Shah,"Gagan Kokri, Aditi Sharma, Karamjit Anmol, Sardar Sohi, Anita Devgan, Ashish Duggal, Nisha Bano, Harby Sangha, Rahul Jungral, Prakash Gadhu",India,2019-05-02,2018,TV-Y7,116 min,"Comedies, Dramas, International Movies",A man who hopes to bring light to his village must compete with an officer from the electricity department to win over the love of his life.,2019,May,116,min
80091267,Movie,Jalpari: The Desert Mermaid,Nila Madhab Panda,"Lehar Khan, Krishang Trivedi, Parvin Dabas, Suhasini Mulay, V.M. Badola, Tannishtha Chatterjee, Rahul Singh, Harsh Mayar",India,2018-05-19,2012,TV-14,94 min,"Dramas, Independent Movies, International Movies","When they travel to their father's ancestral village, city kids expecting a natural paradise instead find a poor, dusty town that harbors secrets.",2018,May,94,min
81038047,Movie,Jonaki,Aditya Vikram Sengupta,"Lolita Chatterjee, Sumanto Chattopadhyay, Ratnabali Bhattacharjee, Jim Sarbh, Indrajit Sinha, Sandershika Tamang, Arunima Sinha, Satya Priya Chakraborty, Christel Das, Burjor Patel",India,2019-05-16,2018,TV-14,96 min,"Dramas, Independent Movies, International Movies","In this quiet, wistful drama, a woman on her deathbed searches her fraying memories for love and fulfillment through surreal, meditative tableaux.",2019,May,96,min
60021906,Movie,Kyo Kii... Main Jhuth Nahin Bolta,David Dhawan,"Govinda, Mohnish Bahl, Sharad Kapoor, Satish Kaushik, Anupam Kher, Kiran Kumar, Rambha, Sushmita Sen",India,2019-05-16,2001,TV-PG,150 min,"Comedies, International Movies, Sci-Fi & Fantasy",The life and career of a lawyer are thrown into chaos when his son's wish magically renders him incapable of telling a lie.,2019,May,150,min
70149579,Movie,"LSD: Love, Sex Aur Dhokha",Dibakar Banerjee,"Anshuman Jha, Rajkummar Rao, Amit Sial, Arya Banerjee, Neha Chauhan, Atul Mongia, Shruti, Herry Tangdi",India,2019-05-16,2010,TV-MA,112 min,"Dramas, Independent Movies, International Movies",This provocative drama examines how the voyeuristic nature of modern society affects three unusual couples in Northern India.,2019,May,112,min
70109375,Movie,Mission Istaanbul: Darr Ke Aagey Jeet Hai,Apoorva Lakhia,"Vivek Oberoi, Zayed Khan, Shriya Saran, Nikitin Dheer, Shabbir Ahluwalia, Sunil Shetty, Shweta Bhardwaj",India,2019-05-16,2008,TV-MA,119 min,"Action & Adventure, International Movies, Music & Musicals",A television journalist makes a risky career move by accepting a job offer from a controversial Istanbul television station.,2019,May,119,min
70289558,Movie,Once Upon a Time in Mumbai Dobaara!,Milan Luthria,"Akshay Kumar, Imran Khan, Sonakshi Sinha, Sonali Bendre, Sarfaraz Khan, Mahesh Manjrekar, Abhimanyu Singh, Kurush Deboo, Pitobash, Chetan Hansraj",India,2019-05-16,2013,TV-14,142 min,"Dramas, International Movies, Music & Musicals","This turbulent sequel to Once Upon a Time in Mumbai carries on the saga of the gangland don Shoaib Khan, who continues pressing for more control.",2019,May,142,min
70158421,Movie,Action Replayy,Vipul Amrutlal Shah,"Akshay Kumar, Aishwarya Rai Bachchan, Om Puri, Kiron Kher, Neha Dhupia, Rannvijay Singh, Aditya Roy Kapoor, Randhir Kapoor, Sudeepa Singh, Alok Kumar, Rajpal Yadav",India,2018-05-16,2010,TV-PG,129 min,"Children & Family Movies, Comedies, International Movies","Vipul Amrutlal Shah directs this sci-fi rom-com that stars Akshay Kumar and Aishwarya Rai as Kishen and Mala, a married couple who are so miserable, they inspire their son, Bunty, to go back in time and make his parents fall in love.",2018,May,129,min
20258084,Movie,Andaz Apna Apna,Rajkumar Santoshi,"Aamir Khan, Salman Khan, Raveena Tandon, Karisma Kapoor, Paresh Rawal, Viju Khote, Shehzad Khan, Deven Verma, Jagdeep, Mehmood",India,2018-05-16,1994,TV-PG,160 min,"Comedies, Cult Movies, International Movies","Broke and with no concrete plans for the future, two young men discover that a stunning heiress lives nearby and try to charm her into marriage.",2018,May,160,min
70111279,Movie,EMI: Liya Hai To Chukana Padega,Saurabh Kabra,"Sanjay Dutt, Arjun Rampal, Malaika Arora, Aashish Chaudhary, Neha Uberoi, Urmila Matondkar, Manoj Joshi, Daya Shanker Pandey, Pushkar Jog, Kulbhushan Kharbanda",India,2019-05-15,2008,TV-14,128 min,"Comedies, Dramas, International Movies",A bank hires an enigmatic and unorthodox debt collector to recover money from four borrowers who are unable to pay their loans.,2019,May,128,min
81123050,Movie,Hamid,Aijaz Khan,"Talha Arshad Reshi, Rasika Dugal, Vikas Kumar, Sumit Kaul, Bashir Lone, Gurveer Singh, Ashraf Nagoo, Mir Sarvar",India,2019-05-15,2018,TV-14,108 min,"Dramas, Independent Movies, International Movies","Wanting his missing father to come home, a Kashmiri boy repeatedly attempts to call God for help – until one day, a hardened army officer picks up.",2019,May,108,min
70007056,Movie,Kucch To Hai,Anil V. Kumar,"Tusshar Kapoor, Esha Deol, Natasha, Jeetendra, Rishi Kapoor",India,2019-05-15,2003,TV-14,136 min,"Dramas, International Movies, Thrillers","A student tries to steal a test from a teacher's home, leaving him for dead after an accident. A string of murders may be the professor's revenge.",2019,May,136,min
70035357,Movie,Kyaa Kool Hai Hum,Sangeeth Sivan,"Tusshar Kapoor, Riteish Deshmukh, Isha Koppikar, Neha Dhupia, Anupam Kher, Jay Sean",India,2019-05-15,2005,TV-14,165 min,"Comedies, International Movies, Music & Musicals","Longtime friends Rahul and Karan head to Mumbai intent on making their dreams come true, but both men are suddenly saddled with bad luck.",2019,May,165,min
80108481,Movie,Kyaa Kool Hain Hum 3,Umesh Ghadge,"Tusshar Kapoor, Aftab Shivdasani, Krishna Abhishek, Mandana Karimi, Shakti Kapoor, Darshan Jariwala, Sushmita Mukherjee, Meghna Naidu, Anand Kumar, Claudia Ciesla",India,2019-05-15,2016,R,124 min,"Comedies, International Movies","When an unlikely porn actor falls for a woman outside the industry, he employs his co-stars as a stand-in traditional family to impress her father.",2019,May,124,min
70153178,Movie,Once Upon a Time in Mumbaai,Milan Luthria,"Ajay Devgn, Emraan Hashmi, Kangana Ranaut, Prachi Desai, Randeep Hooda, Imran Hasnee, Dhiru Dwivedi",India,2019-05-15,2010,NR,133 min,"Dramas, International Movies, Music & Musicals","Mumbai's top mob boss rules the underworld with honor and compassion, but his power-hungry protégé will shake up the world of organized crime.",2019,May,133,min
70073018,Movie,Shootout at Lokhandwala,Apoorva Lakhia,"Sanjay Dutt, Sunil Shetty, Amitabh Bachchan, Arbaaz Khan, Abhishek Bachchan, Diya Mirza, Aarti Chhabria, Tusshar Kapoor, Vivek Oberoi, Neha Dhupia, Rohit Roy, Aditya Lakhia, Ravi Gossain, Shabbir Ahluwalia, Akhilendra Mishra, Amrita Singh",India,2019-05-15,2007,UR,116 min,"Action & Adventure, Dramas, International Movies","Based on a true story, this action film follows an incident that stunned a nation in the early 1990s. In Mumbai, India, the notorious gangster Maya holds off veteran cop Khan and a force of more than 200 policemen in a six-hour bloody gunfight.",2019,May,116,min
80994416,Movie,Aadu 2,Midhun Manuel Thomas,"Jayasurya, Vinayakan, Sunny Wayne, Vijay Babu, Saiju Kurup, Vineeth Mohan, Unni Rajan P. Dev, Dharmajan Bolgatty, Indrans",India,2018-05-15,2017,TV-14,150 min,"Comedies, International Movies","When Shaji Pappan and his gang of goofy outlaws find themselves low on funds, they plan to once again win a hefty prize in a tug-of-war competition.",2018,May,150,min
80243408,Movie,Aiyaary,Neeraj Pandey,"Sidharth Malhotra, Manoj Bajpayee, Rakul Preet Singh, Pooja Chopra, Adil Hussain, Kumud Mishra, Naseeruddin Shah, Anupam Kher, Vikram Gokhale, Juhi Babbar",India,2018-05-15,2018,TV-14,158 min,"Action & Adventure, Dramas, International Movies","When his protégé goes rogue and poses a grave threat to the government he serves, a veteran officer of the Indian Army tries to stop him at all costs.",2018,May,158,min
80157133,Movie,Chamatkar,Rajiv Mehra,"Shah Rukh Khan, Naseeruddin Shah, Urmila Matondkar, Malvika Tiwari, Shammi Kapoor, Deven Verma, Tinnu Anand, Anjana Mumtaz, Anjan Srivastav, Rakesh Bedi",India,2017-05-15,1992,TV-14,164 min,"Comedies, International Movies, Sci-Fi & Fantasy","A village schoolteacher and the ghost of a murdered man, who were both betrayed by those closest to them, join forces to help each other.",2017,May,164,min
80122237,TV Show,Classic Legends,,Javed Akhtar,India,2017-05-15,2012,TV-PG,1 Season,"Docuseries, International TV Shows",This documentary series explores the glamour of Bollywood through the stories of the men and women who have illuminated its screens.,2017,May,1,Season
80157083,Movie,Kabhi Haan Kabhi Naa,Kundan Shah,"Shah Rukh Khan, Suchitra Krishnamoorthi, Deepak Tijori, Rita Bhaduri, Satish Shah, Anjan Srivastav, Goga Kapoor, Tiku Talsania, Ravi Baswani, Naseeruddin Shah",India,2017-05-15,1994,TV-14,151 min,"Comedies, Dramas, International Movies",A dreamer falls for a girl who is in love with someone else and tries to create a rift between her and the man she loves.,2017,May,151,min
24081514,Movie,Ram Jaane,Rajiv Mehra,"Shah Rukh Khan, Juhi Chawla, Vivek Mushran, Pankaj Kapur, Puneet Issar, Tinnu Anand, Deven Verma, Gulshan Grover, Amrit Pal, Arun Bali",India,2017-05-15,1995,TV-14,142 min,"Dramas, International Movies, Music & Musicals","Two boyhood pals – one righteous, the other a criminal – take very different paths to adulthood. Their love for the same woman may prove disastrous.",2017,May,142,min
70261058,Movie,Aiyyaa,Sachin Kundalkar,"Rani Mukerji, Prithviraj Sukumaran, Nirmiti Sawant, Subodh Bhave, Jyoti Subhash, Satish Alekar, Anita Date, Amey Wagh, Kishori Balal, Pakoda Pandi",India,2017-05-10,2012,TV-14,151 min,"Comedies, International Movies, Music & Musicals","An outspoken, imaginative girl from a conservative family pursues her dream man while fending off the prospect of an arranged marriage.",2017,May,151,min
70204288,Movie,Bbuddah Hoga Terra Baap,Puri Jagannadh,"Amitabh Bachchan, Hema Malini, Raveena Tandon, Sonu Sood, Sonal Chauhan, Charmy Kaur, Prakash Raj, Makrand Deshpande, Subbaraju, Shawar Ali, Rajeev Verma",India,2017-05-10,2011,TV-14,116 min,"Action & Adventure, Comedies, Dramas","A cooly confident aging hit man returns from exile in Paris to his old city, Mumbai, to revisit his past and perform one last job.",2017,May,116,min
80057278,Movie,Gabbar Is Back,Krish,"Akshay Kumar, Shruti Haasan, Sunil Grover, Kareena Kapoor, Ishita Vyas, Suman Talwar, Jaideep Ahlawat, Shruti Bapna",India,2017-05-10,2015,TV-14,128 min,"Action & Adventure, Dramas, International Movies","After a vengeful college professor targets corruption in the government, he adopts the name ""Gabbar"" and becomes a hero to a weary public.",2017,May,128,min
70293703,Movie,Madras Café,Shoojit Sircar,"John Abraham, Nargis Fakhri, Rashi Khanna, Avijit Dutt, Prakash Belawadi, Ajay Ratnam, Siddartha Basu, Agnello Dias, Dibang",India,2017-05-10,2013,NR,128 min,"Dramas, International Movies, Thrillers",An Indian intelligence agent journeys to a war-torn coastal island to break a resolute rebel group and meets a passionate journalist.,2017,May,128,min
80165853,Movie,Michael,Ribhu Dasgupta,"Naseeruddin Shah, Mahie Gill, Sabyasachi Chakrabarty, Rudranil Ghosh, Iravati Harshe, Churni Ganguly, June Maliah, Purav Bhandare, Shridhar Watsar",India,2017-05-10,2011,TV-MA,86 min,"Dramas, Independent Movies, International Movies","After a dedicated cop accidentally kills a 12-year-old boy, he's fired, harassed and forced to take menial work as he tries to keep his life together.",2017,May,86,min
81094083,Movie,Kia and Cosmos,Sudipto Roy,"Ritwika Pal, Swastika Mukherjee, Joy Sengupta",India,2019-05-01,2018,TV-14,124 min,"Dramas, Independent Movies, International Movies",A 15-year-old girl with autism attempts to write a mystery novel based on her hunt for the killer of a neighborhood cat.,2019,May,124,min
81093342,Movie,Sur Sapata,Mangesh Kanthale,"Upendra Limaye, Govind Namdeo, Sanjay Jadhav, Anand Ingale, Bharat Ganeshpure, Praveen Tarde, Chinmay Patwardhan, Jivan Karlakar",India,2019-05-01,2019,TV-14,140 min,"Comedies, Dramas, International Movies",A group of small-town students goes for glory by competing in a statewide kabaddi tournament 25 years after their school's championship victory.,2019,May,140,min
80150390,Movie,Abhinetri,A. L. Vijay,"Tamannaah Bhatia, Prabhu Deva, Sonu Sood, Sapthagiri, Murli Sharma, R.V. Udhaykumar, Joy Mathew, Hema",India,2018-05-01,2016,TV-14,131 min,"Comedies, International Movies, Sci-Fi & Fantasy","Due to family pressure, a corporate man reluctantly marries a woman from the village, but in their new home, she abruptly assumes a different persona.",2018,May,131,min
80993495,Movie,Ajji,Devashish Makhija,"Sushama Deshpande, Abhishek Banerjee, Smita Tambe, Sharvani Suryavanshi, Vikas Kumar, Sadiya Siddiqui, Sudhir Pandey, Manuj Sharma",India,2018-05-01,2017,TV-MA,105 min,"Dramas, International Movies","When her small granddaughter is sexually assaulted by a powerful man and no justice is served, a poor, frail old woman plots her violent revenge.",2018,May,105,min
80229034,TV Show,Anjaan: Special Crimes Unit,,"Gashmeer Mahajani, Heena Parmar",India,2018-05-01,2018,TV-14,1 Season,"International TV Shows, TV Horror, TV Mysteries","The cases are supernatural; the police officers human. Together, cops Aditi and Vikrant must solve mysteries from the realm of the paranormal.",2018,May,1,Season
80192548,Movie,CIA: Comrade in America,Amal Neerad,"Dulquer Salmaan, Karthika Muraleedharan, Siddique, Soubin Shahir, Dileesh Pothan, John Vijay, Chandini Sreedharan, Jinu Joseph, Sujith Shankar, Alencier Ley Lopez",India,2018-05-01,2017,TV-14,130 min,"Action & Adventure, Dramas, International Movies","A young man in Kerala has two weeks to stop the woman he loves from a fixed marriage in the U.S., but he doesn't have the papers to get there.",2018,May,130,min
80990815,Movie,Gurgaon,Shanker Raman,"Akshay Oberoi, Pankaj Tripathi, Aamir Bashir, Ragini Khanna, Shalini Vatsa",India,2018-05-01,2017,TV-14,106 min,"Dramas, International Movies, Thrillers","When the daughter of a wealthy family returns from college, she gets a frosty welcome from her brother, who has problems – and plans – of his own.",2018,May,106,min
80990816,Movie,Hombanna,Rakshith Thirthahalli,"Subbu Talabi, Dhanu Gowda, H.G. Dattatreya, Suchendra Prasad, Ambujakshi, Neenasam Ashwath",India,2018-05-01,2017,TV-14,126 min,"Dramas, International Movies","In the forests of Karnataka, a farmer and his community face eviction from the land when they get caught in the currents of socio-political change.",2018,May,126,min
80229102,TV Show,Khan: No. 1 Crime Hunter,,Rajesh Sharma,India,2018-05-01,2018,TV-14,1 Season,"Crime TV Shows, International TV Shows, TV Comedies","From fake marriages to online shopping fraud, a whip-smart police officer investigates truly baffling cons that were inspired by true stories.",2018,May,1,Season
80990811,Movie,Love Ni Bhavai,Saandeep Patel,"Malhar Thakar, Pratik Gandhi, Aarohi Patel, Maulik Jagdish Nayak, Diana Raval, Roopa Divatia, Aarti Patel",India,2018-05-01,2017,TV-PG,163 min,"Comedies, International Movies, Romantic Movies","Not romantically inclined, a popular radio personality finds herself caught between two diametrically opposed suitors.",2018,May,163,min
80206732,Movie,Nibunan,Arun Vaidyanathan,"Arjun, Prasanna, Varalakshmi Sarathkumar, Sruthi Hariharan, Vaibhav Reddy, Suman, Suhasini, Krishna Sekhar",India,2018-05-01,2017,TV-14,124 min,"Action & Adventure, Dramas, International Movies","With numbers written on a doll as their only clue, three officers of the law track down a psychotic killer, unearthing dark secrets along the way.",2018,May,124,min
80990810,Movie,Onaatah,Pradip Kurbah,"Sweety Pala, Merlvin Mukhim, Richard Kharpuri, Enshon Lamare, Mary Nonghuloo, Destina Mawrie, Anvil Laloo, Tashneem Lyngdoh",India,2018-05-01,2016,TV-14,107 min,"Dramas, International Movies","Seeking to heal after a traumatic assault, a young woman retreats to a small village by the hills, where she finds hope, love and new purpose.",2018,May,107,min
80990814,Movie,Ringan,Makarand Mane,"Shashank Shende, Sahil Joshi, Suhas Sirsat, Kalyanee Mulay, Vijay Salve, Umesh Jagtap, Shantanu Gangane, Abhay Mahajan, Vitthal Patil, Ketan Pawar",India,2018-05-01,2015,TV-14,103 min,"Dramas, International Movies","Desperate to save his land, an indebted farmer journeys to Pandharpur to seek divine blessing with his small son, who searches for his mother.",2018,May,103,min
80228322,Movie,Sometimes,Priyadarshan,"Prakash Raj, Shreya Reddy, Ashok Selvan",India,2018-05-01,2016,TV-14,101 min,"Dramas, International Movies","Seven strangers anxiously waiting for their HIV test results decide to bribe the clinic receptionist to get them early, learning one is positive.",2018,May,101,min
