show_id,type,title,director,cast,country,date_added,release_year,rating,duration,listed_in,description,Year_added,Month_added,duration_mins,duration type
70051840,Movie,Katha,Sai Paranjape,"Farooq Shaikh, Naseeruddin Shah, Deepti Naval, Veeni Paranjape Joglekar, Mallika Sarabhai, Arun Joglekar",India,2019-12-31,1982,TV-PG,140 min,"Comedies, Dramas, Independent Movies","Secretly in love with his neighbor, a mild-mannered clerk is heartbroken when his much bolder, more charming friend wins her heart instead.",2019,December,140,min
81213895,Movie,Khubsoorat,Hrishikesh Mukherjee,"Ashok Kumar, Rekha, Rakesh Roshan, Shashikala, Aradhana, Dina Pathak, David Abraham, S.N. Banerjee, Keshto Mukherjee",India,2019-12-31,1980,TV-PG,120 min,"Classic Movies, Comedies, Dramas",A strict matriarch's regimented household is upended by the arrival of a spunky relative who challenges the rules.,2019,December,120,min
24073896,Movie,Koshish,Gulzar,"Sanjeev Kumar, Jaya Bhaduri, Asrani, Seema, Om Shivpuri, Dina Pathak",India,2019-12-31,1972,TV-14,115 min,"International Movies, Romantic Movies",A speech and hearing-impaired couple persists through unforgiving obstacles to be accepted by society and live a life of dignity.,2019,December,115,min
81221913,Movie,Kuldip Patwal: I Didn't Do It!,Remy Kohli,"Deepak Dobriyal, Gulshan Devaiah, Raima Sen, Parvin Dabas, Anurag Arora, Jameel Khan, Priyanka Setia",India,2019-12-31,2017,TV-MA,126 min,"Dramas, Independent Movies, International Movies","Accused of killing a politician, a local grocer’s fight to prove his innocence reveals his lifelong struggles with injustice leading up to the incident.",2019,December,126,min
70040912,Movie,Maine Pyaar Kyun Kiya,David Dhawan,"Salman Khan, Sushmita Sen, Sohail Khan, Katrina Kaif, Arshad Warsi, Isha Koppikar, Rajpal Yadav, Beena Kak",India,2019-12-31,2005,TV-14,137 min,"Comedies, International Movies, Music & Musicals","After lying to his girlfriend, orthopedic surgeon Samir must conjure up a pretend wife in this musical comedy.",2019,December,137,min
81213979,Movie,Masoom,Shekhar Kapur,"Shabana Azmi, Naseeruddin Shah, Saeed Jaffrey, Jugal Hansraj, Urmila Matondkar, Aradhana Srivastav, Tanuja, Supriya Pathak",India,2019-12-31,1983,TV-14,138 min,"Dramas, Independent Movies, International Movies",A loving husband and father's joyful family life is rocked to its core upon the discovery that he has a young son borne from a past extramarital affair.,2019,December,138,min
70018445,Movie,Mujhse Shaadi Karogi,David Dhawan,"Rajpal Yadav, Amrish Puri, Kader Khan, Shashi Kala, Priyanka Chopra, Salman Khan, Akshay Kumar, Satish Shah",India,2019-12-31,2004,TV-PG,158 min,"Comedies, International Movies, Romantic Movies","Samir must overcome a hostile horoscope, a hot temper and a determined rival to win the heart of Rani, the love of his life.",2019,December,158,min
81213897,Movie,Namak Halaal,Prakash Mehra,"Amitabh Bachchan, Shashi Kapoor, Parveen Babi, Smita Patil, Waheeda Rehman, Om Prakash, Ranjeet, Satyendra Kapoor",India,2019-12-31,1982,TV-14,171 min,"Action & Adventure, Comedies, International Movies","While loyally defending his boss from mobsters trying to kill him, a naive, hotel bellboy discovers the family he never knew he had.",2019,December,171,min
81213882,Movie,Phullu,Abhishek Saxena,"Sharib Hashmi, Nutan Surya, Jyotii Sethi, Inaamulhaq, Trisha Kale, Namya Saxena, Shivam Pradhan, Kimti Anand, Paras Raj Gandhi",India,2019-12-31,2017,TV-14,96 min,"Dramas, Independent Movies, International Movies","Struck by the lack of clean resources for menstruating women in his village, a jobless loafer braves social stigmas to create low-cost sanitary napkins.",2019,December,96,min
81213896,Movie,Rajnigandha,Basu Chatterjee,"Vidya Sinha, Amol Palekar, Dinesh Thakur, Ranjita Thakur, Veena Gaud, Manju Maini",India,2019-12-31,1974,TV-PG,104 min,"Comedies, Dramas, Independent Movies","A grad student leaves her boyfriend in Delhi for a job interview in Mumbai, where she reconnects with an old flame for whom she still has feelings.",2019,December,104,min
60003097,Movie,Ram Teri Ganga Maili,Raj Kapoor,"Mandakini, Rajiv Kapoor, Divya Rana, Saeed Jaffrey, Kulbhushan Kharbanda, Raza Murad, Sushma Seth, Trilok Kapoor",India,2019-12-31,1985,TV-14,178 min,"Classic Movies, Dramas, International Movies","Abandoned by her new husband and father of her son, a mountain woman journeys to Calcutta to find him, constantly tested by social evils along the way.",2019,December,178,min
81213887,Movie,Ramji Londonwaley,Sanjay Dayma,"Madhavan, Samita Bangargi, Harsh Chhaya, Rajendranath Zutshi, Shikha Shalu Varma, Satish Shah, Akhilendra Mishra",India,2019-12-31,2005,TV-14,154 min,"Comedies, Dramas, International Movies","A small-town cook moves to London to earn a living, but from his employer’s sudden death to the immigration officials on his trail, plans soon go sour.",2019,December,154,min
81217436,Movie,Road to Sangam,Amit Rai,"Paresh Rawal, Om Puri, Pavan Malhotra, Javed Sheikh, Swati Chitnis, Masood Akhtar, Sudhir Nema, Rakesh Srivastava",India,2019-12-31,2010,TV-14,136 min,"Dramas, Independent Movies, International Movies","As communal violence erupts in his neighborhood, a Muslim mechanic presses forward to repair a historic truck that will transport Gandhi’s last remains.",2019,December,136,min
81221914,Movie,Saath Saath,Raman Kumar,"Deepti Naval, Farooq Shaikh, Satish Shah, Iftekhar, A.K. Hangal, Neena Gupta, Avtar Gill, Javed Khan",India,2019-12-31,1982,TV-14,118 min,"Dramas, Independent Movies, International Movies","A young woman falls for her classmate’s idealistic, non-materialistic ways, but is troubled upon seeing his principles change after they marry.",2019,December,118,min
70072558,Movie,Sadma,Balu Mahendra,"Kamal Hassan, Sridevi, Silk Smitha, Gulshan Grover, Paintal, Arvind Deshpande",India,2019-12-31,1983,TV-14,137 min,"Dramas, International Movies, Romantic Movies","After a traumatic injury leaves her with amnesia and age regression, a young woman is sold to a brothel before a teacher becomes her savior.",2019,December,137,min
60002818,Movie,Sangam,Raj Kapoor,"Raj Kapoor, Vyjayanthimala, Rajendra Kumar, Lalita Pawar, Achala Sachdev, Hari Shivdasani, Raj Mehra, Iftekhar",India,2019-12-31,1964,TV-14,228 min,"Classic Movies, Dramas, International Movies","Returning home from war after being assumed dead, a pilot weds the woman he has long loved, unaware that she had been planning to marry his best friend.",2019,December,228,min
20257617,Movie,Satte Pe Satta,Raj N. Sippy,"Amitabh Bachchan, Hema Malini, Amjad Khan, Sachin, Shakti Kapoor, Ranjeeta Kaur, Paintal, Ranjeet",India,2019-12-31,1982,TV-14,153 min,"Comedies, Cult Movies, Dramas","The eldest of seven brothers who run a family farm together marries a pretty nurse, inspiring his country-bumpkin siblings to follow his example.",2019,December,153,min
70059284,Movie,Shiva,Ram Gopal Varma,"Nagarjuna Akkineni, Amala, Rajendranath Zutshi, Raghuvaran, Paresh Rawal, Brij Gopal, J.D. Chakravarthi, Tanikella Bharani",India,2019-12-31,1990,TV-MA,168 min,"Action & Adventure, Dramas, International Movies","A young man enrolls at a college and becomes a rival to the student-union president, who’s using force and intimidation to advance his criminal agenda.",2019,December,168,min
60001404,Movie,Swami,Basu Chatterjee,"Shabana Azmi, Girish Karnad, Vikram, Dheeraj Kumar, Shashikala, Utpal Dutt, Preeti Ganguli, Sudha Shivpuri",India,2019-12-31,1977,TV-PG,123 min,"Dramas, Independent Movies, International Movies","After she enters into an arranged marriage, a spirited and intellectual young woman tries to adjust to life with a man who was not her choice.",2019,December,123,min
81213879,Movie,The Dark Side of Life: Mumbai City,Tariq Khan,"Mahesh Bhatt, Kay Kay Menon, Avii, Nikhil Ratnaparkhi, Neha Khan, Alisha Khan, Irfan Hussein, Jyoti Malshe, Sayed Gul",India,2019-12-31,2018,TV-MA,121 min,"Dramas, International Movies","Struggling with Mumbai's pressures and private battles with depression, six lives intersect just as they reach a breaking point.",2019,December,121,min
81213898,Movie,The Great Gambler,Shakti Samanta,"Amitabh Bachchan, Zeenat Aman, Neetu Singh, Prem Chopra, Utpal Dutt, Madan Puri, Om Shivpuri, Iftekhar, Sujit Kumar, Roopesh Kumar",India,2019-12-31,1979,TV-14,161 min,"Action & Adventure, Classic Movies, Cult Movies","After unwittingly using his skills to obtain military secrets, a gambler is pursued by a police officer who happens to be his doppelgänger.",2019,December,161,min
70065255,Movie,Traffic Signal,Madhur Bhandarkar,"Kunal Khemu, Neetu Chandra, Konkona Sen Sharma, Upendra Limaye, Ranvir Shorey, Sudhir Mishra, Nassar Abdulla, Manoj Joshi",India,2019-12-31,2007,TV-MA,130 min,"Dramas, Independent Movies, International Movies","Four characters coexist at an urban traffic signal, where all manage to make a meager living until events threaten the source of their livelihood.",2019,December,130,min
60021548,Movie,"Trikal (Past, Present, Future)",Shyam Benegal,"Leela Naidu, Neena Gupta, Anita Kanwar, Soni Razdan, Dalip Tahil, K.K. Raina, Kunal Kapoor, Keith Stevenson, Naseeruddin Shah, Kulbhushan Kharbanda",India,2019-12-31,1985,TV-14,134 min,"Comedies, Dramas, Independent Movies","A Goan native returns to his now-derelict, palatial childhood home, recalling his family’s interpersonal drama during the end of Portuguese rule.",2019,December,134,min
81213873,Movie,Veerey Ki Wedding,Ashu Trikha,"Pulkit Samrat, Yuvika Chaudhry, Jimmy Shergill, Supriya Karnik, Kriti Kharbanda, Satish Kaushik",India,2019-12-31,2018,TV-14,130 min,"Comedies, Dramas, International Movies","Quick to throw punches in the name of justice, a young man must find a calmer way to win over the pacifist father of the girl he wishes to marry.",2019,December,130,min
81213874,Movie,Vodka Diaries,Kushal Srivastava,"Kay Kay Menon, Raima Sen, Mandira Bedi, Sharib Hashmi, Rishi Bhutani, Herry Tangri, Vaishnavi Dhanraj, Swati Rajput",India,2019-12-31,2018,TV-14,113 min,"Dramas, International Movies, Thrillers","While investigating a series of murders and the nightclub that links them, a detective’s case takes an alarming turn when his wife goes missing.",2019,December,113,min
81213884,Movie,Zed Plus,Chandra Prakash Dwivedi,"Adil Hussain, Mona Singh, K.K. Raina, Sanjay Mishra, Anil Rastogi, Ravi Jhankal, Kulbhushan Kharbanda, Ekavali Khanna, Mukesh Tiwari, Vinod Acharya",India,2019-12-31,2014,TV-MA,131 min,"Comedies, Dramas, International Movies",A philandering small-town mechanic's political ambitions are sparked when the visiting prime minister mistakenly grants him special security clearance.,2019,December,131,min
81024730,Movie,Life Ki Toh Lag Gayi,Rakesh Mehta,"Kay Kay Menon, Ranvir Shorey, Manu Rishi Chadha, Pradhuman Singh, Neha Bhasin, Jackie Shroff, Asrani, Neeraj Vora, Sharat Saxena, Tom Alter",India,2018-12-28,2012,TV-14,109 min,"Action & Adventure, Comedies, Dramas","A vengeful son, a cop on a mission, a wannabe actress and a jilted lover find their lives intermingling in unexpected ways over 24 hours in Mumbai.",2018,December,109,min
81024717,Movie,Rehmataan,,"Sukhjinder Shera, Guggu Gill, Deep Dhillon, Raj Virk, Surinder Shinda",India,2018-12-28,2012,TV-14,116 min,"Dramas, International Movies, Romantic Movies","As unemployment, drug addiction and corruption plague a society, this drama depicts the people who believe there’s still good in the world.",2018,December,116,min
80194558,TV Show,Selection Day,,"Mohammad Samad, Yash Shashank Dholye, Rajesh Tailang, Mahesh Manjrekar, Karanvir Malhotra, Ratna Pathak Shah, Akshay Oberoi",India,2018-12-28,2018,TV-14,1 Season,"International TV Shows, TV Dramas, Teen TV Shows",Two teen cricket prodigies struggle against their overbearing father and a system stacked against them to realize their own ambitions and identities.,2018,December,1,Season
80229953,Movie,Madness in the Desert,Satyajit Bhatkal,"Aamir Khan, Ashutosh Gowariker",India,2017-12-22,2004,TV-PG,141 min,"Documentaries, International Movies","The story of making ""Lagaan,"" one of the millennium's seminal Indian films, is told from the point of view of production team member Satyajit Bhatkal.",2017,December,141,min
80206847,Movie,Jab Harry Met Sejal,Imtiaz Ali,"Shah Rukh Khan, Anushka Sharma, Aru Krishansh Verma, Chandan Roy Sanyal, Evelyn Sharma, Kavi Shastri, Barbora Mudrochova, Paula Donner, Denis Dorokhov, Martavious Gayles",India,2017-12-02,2017,TV-14,142 min,"Comedies, International Movies, Romantic Movies",A philandering tour guide in Europe begins to develop feelings for one of his clients while helping her search for her lost engagement ring.,2017,December,142,min
81018239,Movie,Ascharyachakit!,Samit Kakkad,"Priyanka Bose, Vaibhav Raj Gupta, Santosh Juvekar, Anangsha Biswas, Ankit Raaj, Kashmira Irani, Kailash Waghmare, Vipin Sharma",India,2018-12-19,2018,TV-MA,90 min,"Dramas, Independent Movies, International Movies","Entangling the lives of a movie star, a chauffeur, a prostitute and a pimp, this bold drama reveals ugly truths beneath Mumbai’s glitzy veneer.",2018,December,90,min
81045765,Movie,Lilli,Prasobh Vijayan,"Samyuktha Menon, Aaryan Menon, Dhanesh Anand, Kannan Nayar, Sajin Cherukayil, Kevin Jose, Athulya",India,2018-12-17,2018,TV-MA,85 min,"Dramas, International Movies, Thrillers","A woman who's about to give birth finds her maternal instincts kicking in when she's abducted, imprisoned and brutalized by a vicious gang.",2018,December,85,min
81039381,Movie,Andhadhun,Sriram Raghavan,"Tabu, Ayushmann Khurrana, Radhika Apte, Anil Dhawan, Manav Vij, Zakir Hussain, Ashwini Kalsekar, Chhaya Kadam, Pawan Singh, Kabir Sajid",India,2018-12-16,2018,TV-14,137 min,"Comedies, Dramas, International Movies",A visually impaired pianist’s world careens into a series of shocking twists after he unintentionally lands at the murder scene of a former film star.,2018,December,137,min
80074933,Movie,Bangistan,Karan Anshuman,"Riteish Deshmukh, Pulkit Samrat, Kumud Mishra, Chandan Roy Sanyal, Arya Babbar, Shivkumar Subramaniam, Tom Alter, Jacqueline Fernandez",India,2019-12-15,2015,TV-14,134 min,"Comedies, Dramas, International Movies","Sent on the same deadly international mission by their rival religious factions, two men's madcap antics along the way take them hilariously off course.",2019,December,134,min
60021525,Movie,Dil Chahta Hai,Farhan Akhtar,"Aamir Khan, Saif Ali Khan, Akshaye Khanna, Preity Zinta, Sonali Kulkarni, Dimple Kapadia, Ayub Khan, Rajat Kapoor, Suhasini Mulay, Ahmed Khan",India,2019-12-15,2001,TV-14,185 min,"Comedies, Dramas, International Movies","Inseparable childhood friends Akash, Sameer and Siddharth are just out of college. Nothing comes between them – until they each fall in love.",2019,December,185,min
80057585,Movie,Dil Dhadakne Do,Zoya Akhtar,"Anil Kapoor, Priyanka Chopra, Ranveer Singh, Anushka Sharma, Farhan Akhtar, Shefali Shah, Rahul Bose, Parmeet Sethi, Vikrant Massey, Zarina Wahab, Aamir Khan",India,2019-12-15,2015,TV-14,174 min,"Comedies, Dramas, International Movies","While hosting a shipboard holiday for relatives and friends, a wealthy but dysfunctional family must face the ugly truths under their flawless facade.",2019,December,174,min
70059026,Movie,Don,Farhan Akhtar,"Shah Rukh Khan, Priyanka Chopra, Arjun Rampal, Isha Koppikar, Kareena Kapoor, Boman Irani, Om Puri, Pavan Malhotra",India,2019-12-15,2006,TV-MA,169 min,"Action & Adventure, International Movies","A ruthless crime boss and drug lord is nabbed and held captive by the authorities, who send his naïve look-alike to infiltrate the man's gang.",2019,December,169,min
70181734,Movie,Game,Abhinay Deo,"Abhishek Bachchan, Kangana Ranaut, Anupam Kher, Boman Irani, Jimmy Shergill, Shahana Goswami, Gauhar Khan, Sarah-Jane Dias",India,2019-12-15,2011,TV-MA,135 min,"International Movies, Thrillers","A tycoon accuses three strangers of killing his daughter but mysteriously dies before he can expose them, sparking a tangled hunt for the real culprit.",2019,December,135,min
70254352,Movie,Honeymoon Travels Pvt. Ltd.,Reema Kagti,"Shabana Azmi, Boman Irani, Abhay Deol, Minissha Lamba, Kay Kay Menon, Raima Sen, Sandhya Mridul, Vikram Chatwal, Ameesha Patel, Karan Khanna, Diya Mirza, Ranvir Shorey",India,2019-12-15,2007,TV-14,119 min,"Comedies, Dramas, International Movies",This offbeat comedy-drama follows six quirky newlywed couples as they set off on a bus from Mumbai to Goa on their honeymoons.,2019,December,119,min
70134537,Movie,Karthik Calling Karthik,Vijay Lalwani,"Farhan Akhtar, Deepika Padukone, Ram Kapoor, Vivan Bhatena, Vipin Sharma, Yatin Karyekar, Shefali Shah",India,2019-12-15,2010,TV-14,135 min,"Dramas, International Movies, Thrillers","Unlucky in love and bullied at work, an office drone is resigned to his dead-end life until it’s transformed by mysterious calls from … himself.",2019,December,135,min
70001237,Movie,Lakshya,Farhan Akhtar,"Amitabh Bachchan, Hrithik Roshan, Preity Zinta, Om Puri, Sharad Kapoor, Rajendranath Zutshi, Sushant Singh, Prashant Chainani, Shakeel Khan, Ranvir Shorey",India,2019-12-15,2004,TV-14,185 min,"Action & Adventure, Dramas, International Movies","After dropping out of the army, a spoiled teenager reenlists and proves his mettle by becoming an officer just as war breaks out.",2019,December,185,min
70114467,Movie,Luck by Chance,Zoya Akhtar,"Farhan Akhtar, Konkona Sen Sharma, Rishi Kapoor, Dimple Kapadia, Isha Sharvani, Sanjay Kapoor, Juhi Chawla, Hrithik Roshan, Alyy Khan, Sheeba Chaddha",India,2019-12-15,2009,TV-14,156 min,"Dramas, International Movies, Romantic Movies","When Vikram gets tapped to play the male lead in a Bollywood film, he can't believe his luck. But it may ruin his relationship with his girlfriend.",2019,December,156,min
70110883,Movie,Rock On!!,Abhishek Kapoor,"Farhan Akhtar, Arjun Rampal, Purab Kohli, Luke Kenny, Prachi Desai, Shahana Goswami, Koel Purie",India,2019-12-15,2008,TV-14,139 min,"Dramas, International Movies, Music & Musicals","Four friends hoped that their rock band would be a hit. After breaking up, the band members reunite and take another shot at fulfilling their dream.",2019,December,139,min
70262614,Movie,Talaash,Reema Kagti,"Aamir Khan, Rani Mukerji, Kareena Kapoor, Nawazuddin Siddiqui, Shernaz Patel, Sheeba Chaddha",India,2019-12-15,2012,TV-MA,140 min,"Dramas, International Movies, Thrillers","Set in the jumbled landscape of Mumbai, this mystery drama centers on a police inspector who's trying to cope with the collapse of his marriage.",2019,December,140,min
70202336,Movie,Zindagi Na Milegi Dobara,Zoya Akhtar,"Hrithik Roshan, Abhay Deol, Farhan Akhtar, Katrina Kaif, Kalki Koechlin, Deepti Naval, Naseeruddin Shah, Ariadna Cabrol",India,2019-12-15,2011,TV-PG,154 min,"Comedies, Dramas, International Movies",Three friends on an adventurous road trip/bachelor party in Spain learn some lessons about themselves and each other that will change them forever.,2019,December,154,min
80998331,TV Show,Anjaan: Rural Myths,,,India,2018-12-15,2018,TV-14,1 Season,"International TV Shows, TV Horror, TV Thrillers","Spine-chilling stories of malevolent spirits unfold in villages, jungles and haunted buildings across India.",2018,December,1,Season
81045054,Movie,Vanjagar Ulagam,Manoj Beedha,"Guru Somasundaram, Cibi Bhuvana Chandran, Vishagan Vanangamudi, Anisha Ambrose, Chandini Tamilarasan, Azhagamperumal, John Vijay, Vasu Vikram, Hareesh Peradi, Jayaprakash Radhakrishnan",India,2018-12-15,2018,TV-MA,145 min,"Dramas, International Movies, Thrillers",Shyam wakes to discover he's suspected in a murder that one journalist believes may have ties to a mysterious gangster.,2018,December,145,min
70117674,Movie,1920,Vikram Bhatt,"Rajneesh Duggal, Adah Sharma, Indraneil Sengupta, Anjori Alagh, Rajendranath Zutshi, Vipin Sharma, Amin Hajee, Shri Vallabh Vyas",India,2017-12-15,2008,TV-MA,143 min,"Horror Movies, International Movies, Thrillers",An architect and his wife move into a castle that is slated to become a luxury hotel. But something inside is determined to stop the renovation.,2017,December,143,min
80220783,Movie,Breaking Free,Sridhar Rangayan,Sridhar Rangayan,India,2017-12-15,2015,TV-MA,81 min,"Documentaries, International Movies, LGBTQ Movies",One filmmaker’s quest to expose the human rights violations faced by India’s LGBTQ community was a project of passion seven years in the making.,2017,December,81,min
80218586,Movie,Dark Chocolate (Bengali Version),Agnidev Chatterjee,"Riya Sen, Mahima Chaudhry, Rajesh Sharma, Indrasish Roy, Mumtaz Sorcar, Sudip Mukherjee, Shataf Figar, Koushik Sen",India,2017-12-15,2016,TV-MA,91 min,"Dramas, International Movies, Thrillers","In this Bangla thriller inspired by a true story, the discovery of a charred corpse in the woods leads to a high-profile murder investigation.",2017,December,91,min
80203788,Movie,Gelo,Manbhavan Singh,"Jaspinder Cheema, Pavan Malhotra, Gurjit Singh, Dilawar Sidhu, Aditya Sharma, Raj Dhaliwal",India,2017-12-15,2016,TV-MA,118 min,"Dramas, International Movies",A Punjabi woman who works on a farm must endure the difficulties of living in an oppressive class-based society and a dysfunctional community.,2017,December,118,min
80227673,Movie,Kabali (Hindi Version),Pa. Ranjith,"Rajnikanth, Winston Chao, Radhika Apte, Nassar, Dhansika, Kalaiyarasan, Dinesh, John Vijay, Kishore Kumar G., Riythvika",India,2017-12-15,2016,TV-MA,148 min,"Action & Adventure, Dramas, International Movies","In this Hindi version of the Tamil blockbuster, a Tamil gang leader in Kuala Lumpur seeks justice for crimes committed against him and his family.",2017,December,148,min
80218784,Movie,Mantostaan,Rahat Kazmi,"Raghuvir Yadav, Veerendra Saxena, Sonal Sehgal, Aaditya Pratap Singh, Rahat Kazmi, Raina Bassnet, Sakshi Bhat",India,2017-12-15,2017,TV-MA,75 min,"Dramas, Independent Movies, International Movies",Four stories by writer Sadaat Hasan Manto culminate in a single gruesome drama that's set during the partitioning of the Indian subcontinent.,2017,December,75,min
80218783,Movie,Mantra,Nicholas Kharkongor,"Rajat Kapoor, Lushin Dubey, Kalki Koechlin, Shiv Pandit, Adil Hussain, Rohan Joshi, Yuri Suri, Maya Krishna Rao",India,2017-12-15,2017,TV-14,89 min,"Dramas, Independent Movies, International Movies",An Indian business owner struggles to keep his company afloat amid global competition while trying to make up for lost time with his family.,2017,December,89,min
80223049,Movie,Muramba,Varun Narvekar,"Mithila Palkar, Amey Wagh, Sachin Khedekar, Chinmayi Sumit",India,2017-12-15,2017,TV-14,128 min,"Comedies, Dramas, International Movies",A young man and his parents ponder the reasons behind the recent breakdown of a relationship he was in – and the possibility of reconciliation.,2017,December,128,min
80203784,Movie,Rise of the Zombie,"Devaki Singh, Luke Kenny","Luke Kenny, Kirti Kulhari, Ashwin Mushran, Benjamin Gilani",India,2017-12-15,2013,TV-MA,83 min,"Horror Movies, International Movies","A heartbroken wildlife photographer throws himself into his work, only to find himself experiencing strange transformations.",2017,December,83,min
80139507,Movie,Famous in Ahmedabad,Hardik Mehta,,India,2016-12-15,2015,TV-14,29 min,"Documentaries, International Movies",Follow an 11-year-old boy as he goes from ordinary child to colorful competitor in his quest for a big win at India’s biggest kite-flying festival.,2016,December,29,min
81217745,Movie,Baby Dolls,Vijay Kumar Arora,"Nirmal Rishi, Sonam Bajwa, Sukhwinder Chahal, Tania, Gurnam Bhullar",India,2019-12-01,2019,TV-14,127 min,"Comedies, International Movies, Romantic Movies","When two sisters travel from Canada to Punjab to visit their maternal family, they discover an opportunity to mend a broken bond with their grandmother.",2019,December,127,min
81217746,Movie,High End Yaariyan,Pankaj Batra,"Ninja, Ranjit Bawa, Jassi Gill, Musskan Sethi, Navneet Kaur Dhillon, Neet Mahal, Aarushi Sharma",India,2019-12-01,2019,TV-14,120 min,"Comedies, International Movies, Romantic Movies","From romantic pursuits to their friendship, a trio of young men navigate the complexities of relationships while sharing a London apartment.",2019,December,120,min
80182479,Movie,Jindua,Navaniat Singh,"Jimmy Shergill, Sargun Mehta, Neeru Bajwa, Bhavkhandan Singh Rakhra, Arkie Kandola, Nina Rehill, Rajiv Thakur, Harjap Singh Bhangal, Balinder Johal, Carolyn Bridget Kennedy, Sonia Dhillon, Jimmy Sheirgill",India,2019-12-01,2017,TV-14,135 min,"Dramas, International Movies, Romantic Movies",An Indian man in Canada marries a local citizen to legalize his immigration status. The only problem? His girlfriend isn't thrilled about his new wife.,2019,December,135,min
81217743,Movie,Lakeeran,,"Harman Virk, Yuvika Chaudhry, Nirmal Rishi, Shavinder Mahal, B.N. Sharma, Anita Meet, Poonam Sood, B.B. Verma, Satwant Kaur, Gurinder Rai",India,2019-12-01,2016,TV-14,111 min,"Dramas, International Movies, Romantic Movies","Guilt-ridden over his involvement in a fatal car accident, a young ex-pat returns to Punjab, falling for a woman who carries traumas of her own.",2019,December,111,min
81217747,Movie,Qismat,Jagdeep Sidhu,"Ammy Virk, Sargun Mehta, Guggu Gill, Tania, Harby Sangha, Hardeep Gill, Sukhdev Barnala, Satwant Kaur, Baljinder Kaur, Jashanjeet Gosha",India,2019-12-01,2018,TV-PG,137 min,"Dramas, International Movies, Romantic Movies","A young villager moves to Chandigarh and falls for his bubbly neighbor, but their love story is affected by several heartbreaking twists of fate.",2019,December,137,min
81217742,Movie,Thug Life,Mukesh Vohra,"Harish Verma, Jass Bajwa, Rajiv Thakur, Ihana Dhillon, Yograj Singh, Karamjit Anmol, Anita Devgan, Vrajesh Hirjee, Rana Jung Bahadur, Hobby Dhaliwal",India,2019-12-01,2017,TV-14,133 min,"Comedies, Dramas, International Movies",A get-rich-quick scheme goes awry when a group of friends stumbles onto a dangerous conspiracy and wind up getting mistaken for the bad guys.,2019,December,133,min
