show_id,type,title,director,cast,country,date_added,release_year,rating,duration,listed_in,description,Year_added,Month_added,duration_mins,duration type
80166185,Movie,Dangal,Nitesh Tiwari,"Aamir Khan, Sakshi Tanwar, Fatima Sana Shaikh, Sanya Malhotra, Aparshakti Khurana, Zaira Wasim, Suhani Bhatnagar, Ritwik Sahore",India,2017-06-21,2016,TV-PG,161 min,"Dramas, International Movies, Sports Movies",A once-promising wrestler pursues the gold medal he never won by training two of his daughters to compete at the Commonwealth Games.,2017,June,161,min
81131274,Movie,Rakkhosh,"Abhijit Kokate, Srivinay Salian","Sanjay Mishra, Priyanka Bose, Tannishtha Chatterjee, Barun Chanda, Sonamoni Jayant Gadekar, Ashwath Bhatt, Atul Mahale",India,2019-06-20,2019,TV-MA,116 min,"Horror Movies, Independent Movies, International Movies",An asylum patient’s troubled past threatens his grasp on reality as fellow hospital residents begin disappearing at the hands of an unknown entity.,2019,June,116,min
81110386,Movie,Krutant,Datta Mohan Bhandare,"Suyog Rajendra Gorhe, Sandeep Kulkarni, Vidya Karanjikar, Sayli Patil",India,2019-06-02,2019,TV-14,114 min,"Dramas, International Movies","When a busy workaholic leaves town to meet friends, an unexpected delay leads him to the hut of an old man, whose haunting tale could change his life.",2019,June,114,min
81123052,Movie,Luckee,Sanjay Jadhav,"Abhay Mahajan, Dipti Sati, Mayur More, Shubhangi Tambale, Chetan Dalvi, Nilesh Diwekar",India,2019-06-15,2019,TV-14,113 min,"Comedies, International Movies, Romantic Movies","When his friends make a bet that he can woo his college crush, a lovesick student named Luckee struggles between satisfying his heart and hormones.",2019,June,113,min
81113927,Movie,Pihu,Vinod Kapri,Pihu Myra Vishwakarma,India,2019-06-15,2018,TV-14,90 min,"Dramas, Independent Movies, International Movies","A two-year-old must fend for herself when her mother suddenly passes away while her father is gone for a conference, leaving her prone to danger.",2019,June,90,min
80991033,Movie,Lust Stories,"Zoya Akhtar, Karan Johar, Anurag Kashyap, Dibakar Banerjee","Vicky Kaushal, Bhumi Pednekar, Radhika Apte, Neha Dhupia, Manisha Koirala, Akash Thosar, Randeep Jha, Neil Bhoopalam, Jaideep Ahlawat, Sanjay Kapoor, Kiara Advani",India,2018-06-15,2018,TV-MA,121 min,"Comedies, Dramas, International Movies","In the companion to 2013's ""Bombay Talkies,"" four short films by four of India's biggest directors explore love, sex and relationships in modern India.",2018,June,121,min
80187684,Movie,Kanavu Variyam,Arun Chidambaram,"Jiya Anil Manne, Arun Chidambaram, T.P. Gajendran, Gnanasambandam, M. Ilavarasu, Yog Japee, Mayilsamy, Black Pandi",India,2017-06-15,2017,TV-PG,104 min,"Comedies, Dramas, International Movies","Despite doubts from fellow villagers who think he’s crazy, an ambitious dropout commits himself to solving a persistent local electricity crisis.",2017,June,104,min
80222951,TV Show,Leila,,"Huma Qureshi, Siddharth, Rahul Khanna, Arif Zakaria, Seema Biswas, Sanjay Suri, Akash Khurana, Ashwath Bhatt, Anupam Bhattacharya, Adarsh Gourav",India,2019-06-14,2019,TV-MA,1 Season,"International TV Shows, TV Dramas, TV Mysteries","In a near-future world where an oppressive regime segregates society, one woman skirts the system to search for the daughter taken from her years ago.",2019,June,1,Season
81062606,Movie,III Smoking Barrels,Sanjib Dey,"Subrat Dutta, Indraneil Sengupta, Mandakini Goswami, Amrita Chattopadhyay, Nalneesh Neel, Niloy Sankar Gupta, Shiny Gogoi, Siddharth Boro",India,2019-06-01,2017,TV-MA,128 min,"Dramas, Independent Movies, International Movies","In three stories set in Northeast India, a child goes on the run, a young adult falls in with the wrong crowd and a desperate man turns to crime.",2019,June,128,min
80994443,Movie,B.A. Pass 2,Shadab Khan,"Kritika Sachdeva, Sasho, Sanghmitra Hitaishi, Indraneil Sengupta, Saurabh Dubey, Shubhangi Latkar, Sukhbir Kaur Lamba, Arav Chowdharry",India,2018-06-01,2017,TV-14,126 min,"Dramas, International Movies","A young woman eager to avoid an arranged marriage moves to Mumbai, where she learns hard truths about show business, life and love.",2018,June,126,min
80229216,TV Show,Gabru: Hip Hop Revolution,,"Amol Parashar, Harleen Sethi, Chaitanya Sharma, Priya Malik, Pratik Dixit",India,2018-06-01,2018,TV-14,1 Season,"International TV Shows, TV Dramas","Three young, aspiring Indian rappers make their way in a cutthroat music industry, dreaming of fame, stardom and ultimate hip-hop domination .",2018,June,1,Season
80998558,Movie,Natsamrat - Asa Nat Hone Nahi,Mahesh Manjrekar,"Nana Patekar, Medha Manjrekar, Mrinmayee Deshpande, Sunil Barve, Vikram Gokhale, Neha Pendse",India,2018-06-01,2016,TV-14,165 min,"Dramas, International Movies","A veteran Shakespearean actor steps off the stage and into the painful tragedy of old age, facing ungrateful family and his fleeting legacy.",2018,June,165,min
80157084,Movie,Aashik Awara,Umesh Mehra,"Saif Ali Khan, Mamta Kulkarni, Mohnish Bahl, Sharmila Tagore, Saeed Jaffrey, Kader Khan",India,2017-06-01,1993,TV-14,154 min,"Dramas, International Movies, Music & Musicals","Raised by a kindly thief, orphaned Jimmy goes on the run from goons and falls in love with Jyoti, whose father indirectly caused his parents' deaths.",2017,June,154,min
80122189,TV Show,Fear Files... Har Mod Pe Darr,,,India,2017-06-01,2015,TV-MA,1 Season,"International TV Shows, TV Horror, TV Thrillers","Possessed lovers, witches, haunted houses and more bring tales of horror to the screen in this anthology series.",2017,June,1,Season
80121872,TV Show,Jhansi Ki Rani,,"Ulka Gupta, Sameer Dharmadhikari, Amit Pachori, Shailesh Dattar, Aruna Irani",India,2017-06-01,2009,TV-14,1 Season,"International TV Shows, TV Dramas","In British-ruled, 19th-century India, a 14-year-old girl trains as a warrior and becomes a devoted crusader in her country's fight for independence.",2017,June,1,Season
80158920,Movie,Lens,Jayaprakash Radhakrishnan,"Jayaprakash Radhakrishnan, Anand Sami, Aswathy Lal, Misha Ghoshal",India,2017-06-01,2015,TV-MA,109 min,"Dramas, Independent Movies, International Movies","Addicted to webcams and voyeurism, a married man gets more than he bargained for when an online stranger tries to force him to watch a suicide.",2017,June,109,min
80156937,Movie,Oh Darling Yeh Hai India,Ketan Mehta,"Shah Rukh Khan, Deepa Sahi, Javed Jaffrey, Anupam Kher, Amrish Puri, Tom Alter, Tinnu Anand, Sadashiv Amrapurkar, Tiku Talsania, Kader Khan",India,2017-06-01,1995,TV-14,154 min,"Action & Adventure, Comedies, International Movies",A penniless actor new to Mumbai and a beautiful woman he meets one fateful night try to stop a gangster from replacing India's president with a twin.,2017,June,154,min
80158546,Movie,Prince,Lekh Tandon,"Shammi Kapoor, Vyjayantimala, Rajendra Nath, Ajit, Helen, Leela Chitnis, Parveen Choudhary, Sudhir, Sunder, Rashid Khan",India,2017-06-01,1969,TV-14,152 min,"Dramas, International Movies, Romantic Movies","To better himself, a spoiled prince temporarily assumes a commoner’s identity. But he soon learns his palace has been gifted to his father’s new wife.",2017,June,152,min
80156936,Movie,Qila,Umesh Mehra,"Dilip Kumar, Mukul Dev, Rekha, Mamta Kulkarni, Smita Jaykar, Gulshan Grover",India,2017-06-01,1998,TV-14,161 min,"Dramas, International Movies","When an abusive landowner is murdered, his twin brother sets out to find the killer but quickly discovers that everyone, it seems, wanted him dead.",2017,June,161,min
80122238,TV Show,The Golden Years with Javed Akhtar,,,India,2017-06-01,2016,TV-G,1 Season,"Docuseries, International TV Shows","Writer, poet and lyricist Javed Akhtar hosts this musical trip down memory lane, revealing untold stories behind India's best songs of 1950-75.",2017,June,1,Season
80177339,Movie,Motu Patlu: King of Kings,Suhas Kadav,"Saurav Chakrabarty, Vinay Pathak",India,2017-07-06,2016,TV-Y7-FV,109 min,"Children & Family Movies, Comedies","Motu and Patlu want to help a circus lion get back to the jungle. On the way, the three become caught up in an exciting adventure in the forest.",2017,July,109,min
80102266,TV Show,Dharmakshetra,,"Kashmira Irani, Chandan Anand, Dinesh Mehta, Ankit Arora, Pushkar Goggiaa, Anjali Rana, Aarya DharmChand Kumar, Amit Behl, Maleeka Ghai",India,2018-07-05,2014,TV-14,1 Season,"International TV Shows, TV Dramas, TV Sci-Fi & Fantasy","After the ancient Great War, the god Chitragupta oversees a trial to determine who were the battle's true heroes and villains.",2018,July,1,Season
80102162,TV Show,Raja Rasoi Aur Anya Kahaniyan,,,India,2018-07-05,2014,TV-G,1 Season,"Docuseries, International TV Shows","Explore the history and flavors of regional Indian cuisine, from traditional Kashmiri feasts to the vegetarian dishes of Gujarat.",2018,July,1,Season
80102160,TV Show,Stories by Rabindranath Tagore,Anurag Basu,,India,2018-07-05,2015,TV-14,1 Season,"International TV Shows, TV Dramas",The writings of Nobel Prize winner Rabindranath Tagore come to life in this collection of tales set in early-20th-century Bengal.,2018,July,1,Season
81151899,TV Show,7 (Seven),Nizar Shafi,"Rahman, Havish, Regina Cassandra, Nandita Swetha, Anisha Ambrose, Tridha Choudhury, Pujitha Ponnada, Aditi Arya",India,2019-07-30,2019,TV-14,1 Season,TV Shows,"Multiple women report their husbands as missing but when it appears they are looking for the same man, a police officer traces their cryptic connection.",2019,July,1,Season
81005453,Movie,Parmanu: The Story of Pokhran,Abhishek Sharma,"John Abraham, Boman Irani, Diana Penty, Anuja Sathe, Yogendra Tikku, Aditya Hitkari, Vikas Kumar, Ajay Shankar, Darshan Pandya, Mark Benington",India,2018-07-25,2018,TV-14,124 min,"Dramas, International Movies","A dedicated government official puts his career in jeopardy by insisting that India become a nuclear power, a goal that powerful forces resist.",2018,July,124,min
70034607,Movie,Bewafaa,Dharmesh Darshan,"Anil Kapoor, Akshay Kumar, Kareena Kapoor, Sushmita Sen, Shamita Shetty, Manoj Bajpayee, Kabir Bedi, Nafisa Ali, Supriya Pathak, Raj Premi, Supriya Karnik",India,2019-07-21,2005,TV-PG,149 min,"Dramas, International Movies, Romantic Movies","A young woman faces pressure to marry her brother-in-law, after her sister dies while giving birth. But she's secretly in love with someone else.",2019,July,149,min
80996338,TV Show,Typewriter,,"Aarna Sharma, Aaryansh Malviya, Mikail Gandhi, Palash Kamble, Jishu Sengupta, Palomi Ghosh, Purab Kohli, Sameer Kochhar, Sara Gesawat",India,2019-07-19,2019,TV-MA,1 Season,"International TV Shows, TV Horror, TV Mysteries","Three young friends in Goa plan to search an old villa for ghosts, but when a new family moves in, the home’s buried past resurfaces in chilling ways.",2019,July,1,Season
80183329,Movie,Aditi Mittal: Things They Wouldn't Let Me Say,Fazila Allana,Aditi Mittal,India,2017-07-18,2017,TV-MA,63 min,Stand-Up Comedy,"Trailblazing comic Aditi Mittal mixes topical stand-up with frank talk about being single, wearing thongs and the awkwardness of Indian movie ratings.",2017,July,63,min
81113926,Movie,Mauli,Aditya Sarpotdar,"Riteish Deshmukh, Saiyami Kher, Jitendra Joshi, Siddarth Jadhav, Shrikant Yadav, Vijay Nikam, Umesh Jagtap, Usha Naik, Girija Oak, Genelia D'Souza",India,2019-07-17,2018,TV-14,136 min,"Action & Adventure, Dramas, International Movies",An unconventional police officer faces off against a gang of thugs as he tries to bring order to the far-flung village he’s been stationed in.,2019,July,136,min
81155782,Movie,Bogda,Nisheeta Keni,"Suhas Joshi, Mrunmayee Deshpande, Rohit Kokate, Ajinkya Bhosale, Jayant Gadekar, Vivekanand Walake, Pallavi Malvade, Nirmala Tikam",India,2019-07-16,2018,TV-PG,161 min,"Dramas, International Movies",An aspiring dancer accompanies her terminally ill mother on one last road trip that alternately strains and strengthens their knotty relationship.,2019,July,161,min
70171835,Movie,Tahaan,Santosh Sivan,"Purav Bhandare, Anupam Kher, Rahul Bose, Victor Banerjee, Ankush Dubey, Rasika Dugal, Rahul Khanna, Sana Shaikh, Dheirya Sonecha, Fatima Sana Shaikh, Sarika",India,2018-07-15,2008,TV-14,95 min,"Dramas, International Movies","After his family's donkey is confiscated by a moneylender, 8-year-old Tahaan travels across conflict-torn Kashmir to find his beloved pet.",2018,July,95,min
70298393,Movie,Singh Saab the Great,Anil Sharma,"Sunny Deol, Urvashi Rautela, Prakash Raj, Amrita Rao, Anjali Abrol, Johnny Lever, Sanjay Mishra, Yashpal Sharma, Manoj Pahwa, Raj Premi",India,2017-07-15,2013,TV-14,143 min,"Action & Adventure, Dramas, International Movies","As the result of a TV journalist's curiosity, the amazing saga of an honorable government tax collector's past comes to light.",2017,July,143,min
80191557,Movie,Vitti Dandu,Ganesh Kadam,"Dilip Prabhavalkar, Ashok Samarth, Yatin Karyekar, Nishant Bhavsar, Mrunal Thakur, Vikas Kadam, Utpal Sawant, Ravindra Mankani, Shubhankar Atre, Charudatta Bhagwat",India,2017-07-15,2014,TV-14,116 min,"Dramas, International Movies","In a remote village in colonial India, an old man and his grandson display strong differences in their attitudes toward the country's British rulers.",2017,July,116,min
81088331,TV Show,Chhota Bheem,,"Vatsal Dubey, Julie Tejwani, Rupa Bhimani, Jigna Bhardwaj, Rajesh Kava, Mousam, Swapnil",India,2019-07-11,2019,TV-Y7,1 Season,Kids' TV,"A brave, energetic little boy with superhuman powers leads his friends on exciting adventures to guard their fellow Dholakpur villagers from evil.",2019,July,1,Season
80182447,Movie,Angamaly Diaries,Lijo Jose Pellissery,"Antony Varghese, Sarath Kumar, Tito Wilson, Reshma Rajan, Vineeth Vishwam, Kichu Tellus, Bitto Davis, Ullas Jose Chemban, Merin Jose Pottackal, Binny Rinky Benjamin, Amrutha Anna Reji",India,2018-07-01,2017,TV-14,128 min,"Action & Adventure, Comedies, Dramas","After growing up amidst the gang wars of his hometown, Vincent forms an entrepreneurial squad of his own and ends up on the wrong side of the law.",2018,July,128,min
70055855,Movie,Anthony Kaun Hai?,Raj Kaushal,"Sanjay Dutt, Arshad Warsi, Minissha Lamba, Raghuvir Yadav, Anusha Dhandekar, Gulshan Grover, Ravi Baswani",India,2018-07-01,2006,TV-14,122 min,"Comedies, Dramas, International Movies","A forger uses a fake identity in trying to retrieve stolen diamonds buried in a penitentiary, unaware a mob assassin is on the trail of his phony alias.",2018,July,122,min
80994575,Movie,Cappuccino,Noushad,"Dharmajan Bolgatty, Aneesh Menon, Sunil Sukhada, Anita Lukmance, Kottayam Pradeep, Natasha Doshi, Hareesh Perumanna, Sharanya, Vineeth Mohan, Sudhi Koppa",India,2018-07-01,2017,TV-14,126 min,"Comedies, Dramas, International Movies","Richi is a director of commercials whose computer memory drive is accidentally switched with that of Sneha, a woman he soon falls in love with.",2018,July,126,min
60036112,Movie,Chalte Chalte,Aziz Mirza,"Shah Rukh Khan, Rani Mukerji, Jas Arora, Satish Shah, Rajiv Verma, Lillete Dubey, Jayshree T., Johny Lever",India,2018-07-01,2003,TV-PG,166 min,"Dramas, International Movies, Romantic Movies","Priya and Raj are polar opposites. Raj is brash and earthy, while Pirya is sophisticated and something of a perfectionist in all she does. They really are like oil and water, but nonetheless, they dare to fall in love.",2018,July,166,min
80994424,Movie,Chicken Kokkachi,Anuranjan Premji,"Anuranjan Premji, Indrans, Dharmajan Bolgatty, Sudhi Koppa, Bijukuttan, Neha Rathanakaran, Prasanth",India,2018-07-01,2017,TV-14,113 min,"Comedies, International Movies","In the wake of his sister's marriage, a young middle-class man leaves his village and learns that supporting one's self is easier said than done.",2018,July,113,min
80994423,Movie,Daffedar,Johnson Esthappan,"Tini Tom, Malavikka, Sudheer Karamana, Indrans",India,2018-07-01,2017,TV-PG,151 min,"Dramas, International Movies","A retired government worker continues to dedicate himself to public service, but his principled ways soon clash with those of his extravagant sons.",2018,July,151,min
80236278,Movie,Deewana Main Deewana,K.C. Bokadia,"Govinda, Priyanka Chopra, Kader Khan, Prem Chopra, Shakti Kapoor, Sharat Saxena, Himani Shivpuri, Johnny Lever",India,2018-07-01,2013,TV-14,107 min,"Comedies, Dramas, International Movies",A man's instant attraction to a woman becomes an obsession as he adopts a friend's identity and even commits murder in order to get closer to her.,2018,July,107,min
80180851,Movie,Gemini,P.K. Baaburaaj,"Esther Anil, Sijoy Varghese, Renji Panicker, Thanusree Ghosh, Sasi Kalinga, Kishore Sathya, Sethu Lakshmi, Rosin Jolly",India,2018-07-01,2018,TV-PG,130 min,Dramas,"Despite growing up with traits that set her apart from her peers, a young adopted girl discovers her gift when she takes an interest in spelling bees.",2018,July,130,min
80236279,Movie,I Am Kalam,Nila Madhab Panda,"Gulshan Grover, Harsh Mayar, Pitobash, Hussan Saad, Beatrice Ordeix, Sanjay Chauhan",India,2018-07-01,2010,TV-PG,87 min,"Children & Family Movies, Comedies, Dramas",An intelligent boy born into poverty befriends the son of a once noble family and is inspired by the life of India's president to pursue an education.,2018,July,87,min
80994573,Movie,Kaviyude Osyath,Vineeth Anil,"Prakash Bare, Arun Kumar, Kulappulli Leela, Sangeetha Mohan, Kochu Preman",India,2018-07-01,2017,TV-PG,116 min,"Dramas, International Movies","When a late poet leaves behind his property to a young man, the man's brother suspects the poet may have been more than just a family friend.",2018,July,116,min
80994425,Movie,Ma Chu Ka,Jayan Vannery,"Pasupathy, Janani Iyer, Pratap Pothen",India,2018-07-01,2017,TV-14,117 min,"International Movies, Thrillers",The relationship between a journalist and a lawyer she meets while investigating a story grows complicated as she uncovers layers of deception.,2018,July,117,min
81002211,Movie,My Birthday Song,Samir Soni,"Sanjay Suri, Nora Fatehi, Zenia Starr, Suparna Krishna, Elena Kazan",India,2018-07-01,2018,TV-14,92 min,"Dramas, International Movies, Thrillers","After a wild night of impulse and infidelity, advertising executive Rajiv Kaul must navigate the blurred lines between life, death, fact and fiction.",2018,July,92,min
70062158,Movie,Namastey London,Vipul Amrutlal Shah,"Akshay Kumar, Katrina Kaif, Rishi Kapoor, Upen Patel, Javed Sheikh, Nina Wadia, Clive Standen, Tiffany Mulheron",India,2018-07-01,2007,TV-PG,130 min,"Dramas, International Movies, Romantic Movies","To her Indian parents' dismay, London-born Jasmeet ""Jazz"" Malhotra longs for everything Western, including her British boyfriend. On a family trip to India, her father arranges Jazz's nuptials to Arjun Ballu Singh, who's smitten with his new bride.",2018,July,130,min
80994419,Movie,Paathi,Chandran Narikode,"Indrans, Joy Mathew, Kalabhavan Shajohn, Sasi Kalinga, Santhosh Keezhattoor, Valsala Menon, Seema G. Nair, Parvathi T",India,2018-07-01,2017,TV-MA,89 min,"Dramas, International Movies",A face painter for Theyyam rituals who is himself disfigured conceals his guilt over the fact that he performs abortions as a medical practitioner.,2018,July,89,min
80994426,Movie,Pareeth Pandaari,Gafoor Y. Elliyaas,"Kalabhavan Shajohn, Sajitha Madathil, Jaffer Idukki, Sunil Sukhada, Joy Mathew, Ansiba",India,2018-07-01,2017,TV-PG,109 min,"Dramas, Independent Movies, International Movies","As the parents of three unmarried daughters, a humble cook and his wife contend with the challenges of matchmaking and social expectations.",2018,July,109,min
80994574,Movie,Paulettante Veedu,Dileep Narayanan,"Saikumar, Amal Unnithan, Manasa Radhakrishnan, K.P.A.C. Lalitha, Sudheer Karamana, Seema G. Nair",India,2018-07-01,2016,TV-14,104 min,"Dramas, International Movies","A wealthy businessman's miserly habits cause no small amount of stress and embarrassment to his family, particularly his daughter.",2018,July,104,min
70125939,Movie,Paying Guests,Paritosh Painter,"Shreyas Talpade, Javed Jaffrey, Aashish Chaudhary, Vatsal Seth, Celina Jaitly, Johnny Lever, Delnaaz Paul, Riya Sen, Sayali Bhagat, Neha Dhupia",India,2018-07-01,2009,TV-14,114 min,"Comedies, International Movies","Desperate for a place to live, twentysomething bachelors Parikshit, Jayesh, Parag and Bhavesh finally locate a house to rent, only to learn that the landlords will consider married applicants only.",2018,July,114,min
80994420,Movie,Sarvopari Palakkaran,Venugopan,"Anoop Menon, Alencier Ley Lopez, Balu Varghese, Aparna Balamurali, Anu Sithara, Gayathri Arun, Nandu, Chali Pala",India,2018-07-01,2017,TV-14,133 min,"Dramas, International Movies","In the course of a human trafficking investigation, a conservative cop crosses paths with an artist-activist in a clash of worldviews.",2018,July,133,min
70034610,Movie,Socha Na Tha,Imtiaz Ali,"Abhay Deol, Ayesha Takia, Apoorva Jha, Ayesha Jhulka, Rati Agnihotri, Sandhya Mridul, Suresh Oberoi, Manish Chaudhary",India,2018-07-01,2005,TV-PG,137 min,"Comedies, International Movies, Romantic Movies","An arranged marriage becomes a friendship for Viren and Aditi, who aren't in love – until they begin having unexpected feelings for each other.",2018,July,137,min
80994421,Movie,Theeram,Saheed Arafath,"Pranav Ratheesh, Maria Yohannan, Askar Ameer, Tini Tom, Anjali Nair, Krishna Prabha, Sudhi Koppa, Nandhan Unni",India,2018-07-01,2017,TV-14,104 min,"Dramas, International Movies, Romantic Movies","An auto rickshaw driver harbors a deep affection for a young woman, but his troubled past threatens to stand between them.",2018,July,104,min
80236280,Movie,Tum Milo Toh Sahi,Kabir Sadanand,"Nana Patekar, Dimple Kapadia, Sunil Shetty, Vidya Malvade, Rehan Khan, Anjana Sukhani, Mohnish Bahl, Vrajesh Hirjee",India,2018-07-01,2010,TV-PG,128 min,"Comedies, Dramas, International Movies",An astute but old-fashioned law clerk steps up to help the owner of a cafe in a legal battle that has both business and personal ramifications.,2018,July,128,min
80994572,Movie,Viswasapoorvam Mansoor,P.T. Kunju Muhammad,"Roshan Mathew, Asha Sarath, Prayaga Martin, Zarina Wahab, Renji Panicker, Leona Lishoy, Santhosh Keezhattoor, Sunil Sukhada",India,2018-07-01,2017,TV-14,125 min,"Dramas, International Movies","When a mother and her daughter arrive to stay in his home in Kerala, a young Muslim man becomes torn between love, faith and clashing political views.",2018,July,125,min
80993648,Movie,Zoo,Shlok Sharma,"Shashank Arora, Shweta Tripathi, Rahul Kumar, Gopal K. Singh, Yogesh Kurme, Prince Daniel",India,2018-07-01,2018,TV-MA,94 min,"Dramas, Independent Movies, International Movies","A drug dealer starts having doubts about his trade as his brother, his client, and two rappers from the slums each battle their own secret addictions.",2018,July,94,min
80158390,Movie,Amrapali,Lekh Tandon,"Vyjayantimala, Sunil Dutt, Prem Nath, Bipin Gupta, Gajanan Jagirdar, Zul Vellani, K.N. Singh, Randhir",India,2017-07-01,1966,TV-PG,116 min,"Dramas, International Movies, Music & Musicals","In the age of Buddha and his philosophy of nonviolence, a warmonger king plots the destruction of an enemy kingdom to rescue the woman he loves.",2017,July,116,min
80158481,Movie,Lal Patthar,Sushil Majumdar,"Raaj Kumar, Hema Malini, Rakhee Gulzar, Vinod Mehra, Asit Kumar Sen, Paintal, Dulari, Chandramohan, Sujata Bakshi, Meena T.",India,2017-07-01,1971,TV-PG,153 min,"Classic Movies, Dramas, International Movies","A vain, self-righteous nobleman falls in love with a village girl and tries to transform her into his version of the ideal woman.",2017,July,153,min
70299811,Movie,Liar's Dice,Geetu Mohandas,"Nawazuddin Siddiqui, Geetanjali Thapa, Manya Gupta, Murari Kumar",India,2017-07-01,2013,TV-MA,104 min,"Dramas, Independent Movies, International Movies",A woman from a small mountain village disobeys her village elders and sets out for the big city in search of her missing husband.,2017,July,104,min
70229498,Movie,Players,"Abbas Alibhai Burmawalla, Mastan Alibhai Burmawalla","Vinod Khanna, Abhishek Bachchan, Bobby Deol, Sonam Kapoor, Bipasha Basu, Neil Nitin Mukesh, Sikander Kher, Omi Vaidya, Johnny Lever, Shweta Bhardwaj",India,2017-07-01,2012,TV-14,162 min,"Action & Adventure, International Movies","Learning of a fortune in gold being secretly shipped to Romania, master thieves Charlie and Riya assemble a crack team to steal it.",2017,July,162,min
20257393,Movie,Professor,Lekh Tandon,"Shammi Kapoor, Kalpana, Lalita Pawar, Parveen Choudhary, Salim, Pratima Devi, Rashid Khan, Bir Sakuja, Bela Bose, Ratnamala",India,2017-07-01,1962,TV-PG,163 min,"Comedies, Dramas, International Movies",A college grad in need of money must disguise himself as an old man to tutor two young women who are under the watchful eye of their strict aunt.,2017,July,163,min
80157132,Movie,Yaar Gaddar,Umesh Mehra,"Mithun Chakraborty, Saif Ali Khan, Somy Ali, Prem Chopra, Gulshan Grover, Puneet Issar, Himani Shivpuri, Johnny Lever, Yunus Parvez, Umesh Shukla",India,2017-07-01,1994,TV-14,148 min,"Dramas, International Movies","When his brother becomes involved in a deadly bank robbery, a heartbroken cop vows to track down and retrieve his wayward sibling – dead or alive.",2017,July,148,min
80108386,Movie,X: Past Is Present,"Hemant Gaba, Pratim D. Gupta, Sudhish Kamath, Nalan Kumarasamy, Anu Menon, Sandeep Mohan, Qaushiq Mukherjee, Rajshree Ojha, Raja Sen, Abhinav Shiv Tiwari, Suparn Verma","Anshuman Jha, Rajat Kapoor, Pooja Ruparel, Piaa Bajpai, Huma Qureshi, Usha Uthup, Radhika Apte, Swara Bhaskar",India,2016-07-01,2015,NR,105 min,"Dramas, Independent Movies, International Movies","When a middle-aged filmmaker meets an alluring stranger at a party, he's haunted by troubling memories of his past relationships.",2016,July,105,min
